names,company and positions,Area,Email
Harshavardhan Reddy Tatireddy ,Software Developer at Sellcraft Global Solutions Pvt Ltd ,"Bengaluru, Karnataka, India ",       Email    tatireddyharshavardhan@gmail.com  
Aparna Racharla ,Genpact associate ,"Hyderabad, Telangana, India ","       Connected    September 18, 2019  "
adhi sheshu ,Student at Malla Reddy Engineering College ,India ,       Email    akhiladhi5p2@gmail.com  
Mohan Rao Pathuri ,Student at Malla Reddy Engineering College ,"Hyderabad Area, India ",       Email    pathurimohanrao@gmail.com  
Sai Kiran Goud ,"Senior Security Engineer at Kony, Inc. ","Hyderabad, Telangana, India ",       Email    saikiran.goundla@outlook.com  
Mohan Rao Pathuri ,Works at Oracle India Pvt Ltd ,"Hyderabad Area, India ",       Email    pathurimohanrao@gmail.com  
Alekhya Bulusu ,SDS Associate at Amazon Hyderabad ,"Hyderabad Area, India ",
